{
  "version": "0.1",
  "trace": "trace-burn-001",
  "deployment_profile_id": "nixos-host-main",
  "subject_id": "spiffe://example/host/nixos-1",
  "consumer_id": "systemd:analytics.service",
  "consumer_kind": "systemd-unit",
  "secret_ref": "db/analytics",
  "secret_class": "database-credential",
  "requested_capability": "issue-dynamic",
  "requested_method": "systemd-credential",
  "requested_ttl_s": 300,
  "required_posture_digest": "sha256:good-posture-digest",
  "labels": [
    "analytics",
    "readonly"
  ]
}
